{
  "unitNumber": 12,
  "microPractice": {
    "j0wJBEZdwLs": [
      {
        "id": "mp_j0wJBEZdwLs_1",
        "prompt": "The Laplace transform of $f(t)$ is defined by which integral?",
        "hint": "It weights $f(t)$ by a decaying exponential and integrates over all positive time.",
        "answerOptions": [
          {
            "text": "$F(s) = \\int_0^{\\infty} e^{-st} f(t)\\,dt$",
            "correct": true,
            "rationale": "Yes. The Laplace transform integrates $f(t)$ against the kernel $e^{-st}$ from $0$ to infinity."
          },
          {
            "text": "$F(s) = \\int_0^{\\infty} e^{st} f(t)\\,dt$",
            "rationale": "A positive exponent generally diverges. What sign does the kernel $e^{-st}$ carry?"
          },
          {
            "text": "$F(s) = \\int_{-\\infty}^{\\infty} e^{-st} f(t)\\,dt$",
            "rationale": "The one-sided transform starts at $0$, not $-\\infty$. What is the lower limit?"
          },
          {
            "text": "$F(s) = \\int_0^{\\infty} e^{-st} f'(t)\\,dt$",
            "rationale": "The definition transforms $f$ itself, not its derivative. What function sits in the integrand?"
          }
        ]
      },
      {
        "id": "mp_j0wJBEZdwLs_2",
        "prompt": "The Laplace transform converts a function of $t$ into a function of which variable?",
        "hint": "The output lives in a new domain indexed by the transform variable.",
        "answerOptions": [
          {
            "text": "$s$, the complex frequency variable",
            "correct": true,
            "rationale": "Yes. The transform maps a time function $f(t)$ into a function $F(s)$ of the variable $s$."
          },
          {
            "text": "$t$, the same time variable",
            "rationale": "The whole point is to leave the time domain. What variable indexes the output?"
          },
          {
            "text": "$x$, a spatial variable",
            "rationale": "No spatial variable is introduced. What variable does the transform produce?"
          },
          {
            "text": "$n$, a discrete index",
            "rationale": "The Laplace transform is continuous, not indexed by integers. What continuous variable does it use?"
          }
        ]
      },
      {
        "id": "mp_j0wJBEZdwLs_3",
        "prompt": "What kind of mathematical object is the Laplace transform?",
        "hint": "It takes one function in and returns another function.",
        "answerOptions": [
          {
            "text": "An integral transform that maps functions to functions",
            "correct": true,
            "rationale": "Yes. It is an integral transform, sending a function of $t$ to a function of $s$."
          },
          {
            "text": "A single number computed from $f$",
            "rationale": "The output is a whole function $F(s)$, not one number. What does the transform return?"
          },
          {
            "text": "A derivative operator",
            "rationale": "It integrates rather than differentiates. What sort of operator maps $f(t)$ to $F(s)$?"
          },
          {
            "text": "A change of units",
            "rationale": "It is far more than rescaling units. What operation produces $F(s)$ from $f(t)$?"
          }
        ]
      },
      {
        "id": "mp_j0wJBEZdwLs_4",
        "prompt": "What is the central reason the Laplace transform is useful for differential equations?",
        "hint": "Consider what it does to the operation of differentiation.",
        "answerOptions": [
          {
            "text": "It turns differentiation into multiplication by $s$, converting ODEs into algebra",
            "correct": true,
            "rationale": "Yes. Derivatives become powers of $s$, so a differential equation becomes an algebraic one."
          },
          {
            "text": "It makes every function periodic",
            "rationale": "It does not impose periodicity. What does it do to the derivative operation?"
          },
          {
            "text": "It eliminates the need for initial conditions",
            "rationale": "Initial conditions actually enter the transform of derivatives. What operational simplification does it provide?"
          },
          {
            "text": "It converts integrals into derivatives",
            "rationale": "Integration becomes division by $s$, not differentiation. What happens to differentiation under the transform?"
          }
        ]
      },
      {
        "id": "mp_j0wJBEZdwLs_5",
        "prompt": "Why does the kernel use a decaying exponential $e^{-st}$ rather than a growing one?",
        "hint": "Think about whether the defining integral can converge.",
        "answerOptions": [
          {
            "text": "The decay helps the improper integral converge for a wide class of functions",
            "correct": true,
            "rationale": "Yes. The decaying factor tames growth in $f(t)$ so the integral to infinity can converge."
          },
          {
            "text": "It makes the transform always zero",
            "rationale": "The transform is generally nonzero. What does the decay accomplish for the integral?"
          },
          {
            "text": "It is an arbitrary choice with no effect",
            "rationale": "The sign of the exponent is essential. What would a growing exponential do to convergence?"
          },
          {
            "text": "It removes the dependence on $s$",
            "rationale": "The output still depends on $s$. Why is a decaying kernel needed for the integral?"
          }
        ]
      }
    ],
    "-j8PzkZ70Lg": [
      {
        "id": "mp_-j8PzkZ70Lg_1",
        "prompt": "Euler's formula expresses $e^{i\\theta}$ as which combination?",
        "hint": "It links the complex exponential to the basic trigonometric functions.",
        "answerOptions": [
          {
            "text": "$\\cos\\theta + i\\sin\\theta$",
            "correct": true,
            "rationale": "Yes. Euler's formula is $e^{i\\theta} = \\cos\\theta + i\\sin\\theta$."
          },
          {
            "text": "$\\cos\\theta - i\\sin\\theta$",
            "rationale": "That is $e^{-i\\theta}$, the conjugate. What sign does $e^{i\\theta}$ carry on the sine term?"
          },
          {
            "text": "$\\sin\\theta + i\\cos\\theta$",
            "rationale": "The real part is the cosine, not the sine. Which function is real in $e^{i\\theta}$?"
          },
          {
            "text": "$\\cos\\theta + \\sin\\theta$",
            "rationale": "The imaginary unit $i$ multiplies the sine. Where does $i$ appear in Euler's formula?"
          }
        ]
      },
      {
        "id": "mp_-j8PzkZ70Lg_2",
        "prompt": "In the complex exponential $e^{st}$ with $s = \\sigma + i\\omega$, what does the imaginary part $\\omega$ control?",
        "hint": "Split $e^{st} = e^{\\sigma t}e^{i\\omega t}$ and recall what each factor does.",
        "answerOptions": [
          {
            "text": "The oscillation frequency",
            "correct": true,
            "rationale": "Yes. The factor $e^{i\\omega t}$ oscillates, so $\\omega$ sets the frequency."
          },
          {
            "text": "The growth or decay rate",
            "rationale": "That is governed by the real part $\\sigma$. What does the imaginary part drive?"
          },
          {
            "text": "The amplitude",
            "rationale": "Amplitude is a separate constant multiplier. What does $\\omega$ in $e^{i\\omega t}$ control?"
          },
          {
            "text": "The phase shift only",
            "rationale": "The imaginary part sets the rate of oscillation, not just a fixed phase. What does $\\omega$ determine?"
          }
        ]
      },
      {
        "id": "mp_-j8PzkZ70Lg_3",
        "prompt": "In $e^{st}$ with $s = \\sigma + i\\omega$, what does the real part $\\sigma$ control?",
        "hint": "Consider the factor $e^{\\sigma t}$ on its own.",
        "answerOptions": [
          {
            "text": "The exponential growth (if positive) or decay (if negative)",
            "correct": true,
            "rationale": "Yes. The factor $e^{\\sigma t}$ grows when $\\sigma > 0$ and decays when $\\sigma < 0$."
          },
          {
            "text": "The oscillation frequency",
            "rationale": "Frequency comes from the imaginary part $\\omega$. What does $\\sigma$ govern in $e^{\\sigma t}$?"
          },
          {
            "text": "The period of oscillation",
            "rationale": "The period is tied to $\\omega$, not $\\sigma$. What does the real exponential factor do?"
          },
          {
            "text": "Nothing; it is ignored",
            "rationale": "The real part is essential to convergence and growth. What behavior does $e^{\\sigma t}$ produce?"
          }
        ]
      },
      {
        "id": "mp_-j8PzkZ70Lg_4",
        "prompt": "Why is the complex exponential $e^{st}$ a natural building block for linear differential equations?",
        "hint": "Think about what differentiating $e^{st}$ returns.",
        "answerOptions": [
          {
            "text": "Differentiating it just multiplies by $s$, so it is an eigenfunction of differentiation",
            "correct": true,
            "rationale": "Yes. Since $\\frac{d}{dt}e^{st} = s e^{st}$, the exponential reproduces itself under differentiation."
          },
          {
            "text": "It is always equal to one",
            "rationale": "Its value varies with $t$. What special property does it have under differentiation?"
          },
          {
            "text": "It cannot be differentiated",
            "rationale": "It is smooth and easily differentiated. What does differentiating it produce?"
          },
          {
            "text": "Its derivative is zero",
            "rationale": "Its derivative is $s e^{st}$, not zero. What does differentiation do to it?"
          }